idLycee;login;password;Appellation officielle;Commune
1;charlesroussel;%FW7GG#z@5XU;Centre d'enseignement professionnel et d'accueil des jeunes;Saint-Genis-Laval
2;acharpentier;CaY&gT0xc(8C;Ecole générale privée Cours Pascal;Lyon 1er Arrondissement
3;gregoirebesnard;3ytCD1In+HY5;Ecole privée multilingue Ombrosa;Caluire-et-Cuire
4;pauletteroussel;q3B&^Zgt$+!c;Ecole privée Silvya Terrade - International Silvya Terrade;Lyon 6e  Arrondissement
5;aimeebegue;&7Glnri6C4Ua;Ecole privée Silvya Terrade - Villefranche-sur-Saône;Villefranche-sur-Saône
6;davidallain;uraGDNcv@WU2;Ecole professionnelle privée Atelier d'Apprentissage de Gorge de Loup;Lyon 9e  Arrondissement
7;andree94;@ZfJBYlS!3Yo;Ecole professionnelle privée Ateliers d'Apprentissage de la Giraudière;Brussieu
8;davidguyon;S2@S$uWv+a7F;Ecole professionnelle privée ELEA Presqu'île;Lyon 2e  Arrondissement
9;alixleduc;T6AFhf4R@9*Y;Ecole professionnelle privée Ipso Lyon;Lyon 7e  Arrondissement
10;brunetdenise;Y*Pla_dMb00V;Ecole professionnelle privée Studio M;Villeurbanne
11;dclerc;pb09F5Ck2!u&;Ecole secondaire privée International School Of Lyon;Sainte-Foy-lès-Lyon
12;vidalalphonse;(rDP$ZhSZ+J6;Ecole secondaire privée IPESS;Lyon 7e  Arrondissement
13;anais15;$gllNS0P*2Xw;Ecole technologique privée Arts Appliqués Bellecour;Lyon 2e  Arrondissement
14;louise36;0!eYYl3n%Z1e;Ecole technologique privée de Condé;Lyon 7e  Arrondissement
15;fblanc;6TV6RpjIcb!k;Ecole technologique privée Supdemod;Lyon 2e  Arrondissement
16;clegrand;tvVL6Y1y!D^c;Etablissement régional d'enseignement adapté Cité Scolaire René Pellet - Lycée des métiers du tertiaire et de l'artisanat d'art;Villeurbanne
17;marinesamson;*Y6fGXMy_!2o;Lycée agricole privé Jean Monnet de Saint-symphorien-sur-Coise;Saint-Symphorien-sur-Coise
18;bbarthelemy;#2ZdBt2w3bHN;Lycée agricole privé Lyon Pressin de Saint-Genis-Laval;Saint-Genis-Laval
19;vincentlaure;&FhsBMNv35RA;Lycée agricole privé Sandar de Limonest;Limonest
20;noemiolivier;p5LEVGkq(8xP;Lycée d'enseignement général et technologique agricole de Lyon - Dardilly;Dardilly
21;emmanuelle05;s7qvz4iX^bE0;Lycée d'enseignement général et technologique agricole de Saint-Genis-Laval;Saint-Genis-Laval
22;philippine61;^4ZDBsmEpAne;Lycée général Cité scolaire internationale;Lyon 7e  Arrondissement
23;hrobert;5tYQI&%e@vl(;Lycée général du Parc;Lyon 6e  Arrondissement
24;suzannecarlier;#&X0F9flJdfg;Lycée général et technologique Albert Camus;Rillieux-la-Pape
25;pbuisson;NI1mUDDq(28$;Lycée général et technologique Ampère;Lyon 2e  Arrondissement
26;ucohen;m%_1JX_q!KET;Lycée général et technologique Antoine de Saint-Exupéry;Lyon 4e  Arrondissement
27;alphonse29;e^9@W(Wsgs%N;Lycée général et technologique Auguste et Louis Lumière;Lyon 8e  Arrondissement
28;pineauadelaide;bsR8Ts&a2()9;Lycée général et technologique Blaise Pascal;Charbonnières-les-Bains
29;guillotpierre;90Ls+GW(Sih*;Lycée général et technologique Colbert;Lyon 8e  Arrondissement
30;nbarre;*5Q$lDsplpso;Lycée général et technologique Condorcet;Saint-Priest
31;guillotfrancois;_(0%P4Ow8Zug;Lycée général et technologique Edouard Herriot;Lyon 6e  Arrondissement
32;lucy61;&0SgJx3R@Wj4;Lycée général et technologique Jean Perrin;Lyon 9e  Arrondissement
33;jaubry;4GAx8+B_^%Uy;Lycée général et technologique Jean-Paul Sartre;Bron
34;zoe07;X%7Q@BiHBm@C;Lycée général et technologique Juliette Récamier;Lyon 2e  Arrondissement
35;frederic60;+L1yvq8*g4sL;Lycée général et technologique La Martinière Diderot;Lyon 1er Arrondissement
36;lucylaporte;#MQLYDrw)E05;Lycée général et technologique La Martinière Duchère;Lyon 9e  Arrondissement
37;bertrandbertrand;TFs%qQyd(35Z;Lycée général et technologique La Martinière Monplaisir;Lyon 8e  Arrondissement
38;pfouquet;!SkZW&Ip79J^;Lycée général et technologique Lacassagne;Lyon 3e  Arrondissement
39;jcollet;057&XsPkNpP6;Lycée général et technologique Marcel Sembat;Vénissieux
40;daisy40;$GpCGcl3p1et;Lycée général et technologique Parc Chabrières;Oullins
41;dumontanouk;&8R^#3n@Fgi6;Lycée général et technologique Pierre Brossolette;Villeurbanne
42;simone48;f5jYyPz))jxF;Lycée général et technologique privé Al Kindi;Décines-Charpieu
43;laetitia13;e3hh)gK*$EU^;Lycée général et technologique privé Assomption Bellevue;La Mulatière
44;rleduc;rO47zDVlv@hV;Lycée général et technologique privé Aux Lazaristes;Lyon 5e  Arrondissement
45;isaaclabbe;__MMxPiC#F0E;Lycée général et technologique privé Belmont-Capdepon;Lyon 7e  Arrondissement
46;letellierchristelle;(cyifAd&D9RB;Lycée général et technologique privé Champagnat;Saint-Symphorien-sur-Coise
47;philippede-sousa;7%66xvyY(zNH;Lycée général et technologique privé Charles de Foucauld;Lyon 3e  Arrondissement
48;antoinettemoreau;@7UTjDT77e9B;Lycée général et technologique privé des Chassagnes;Oullins
49;allainrenee;jbIB8VdxCa!^;Lycée général et technologique privé Institution des Chartreux;Lyon 1er Arrondissement
50;gauthierlorraine;IARbN6vO#(9T;Lycée général et technologique privé Jean-Baptiste de La Salle;Lyon 1er Arrondissement
51;rene15;MX4O6cdh5!9);Lycée général et technologique privé La Favorite Sainte Thérèse;Lyon 5e  Arrondissement
52;auroregautier;SdKe0tKH+42#;Lycée général et technologique privé Notre Dame de Bel Air;Tarare
53;jean04;%fQVnNx08f0U;Lycée général et technologique privé Notre Dame des Minimes;Lyon 5e  Arrondissement
54;reneguerin;Sj+2Syui2cuc;Lycée général et technologique privé Saint Charles;Rillieux-la-Pape
55;poulainjeanne;L3X7L0zZusP%;Lycée général et technologique privé Saint Louis-Saint Bruno;Lyon 1er Arrondissement
56;theresebreton;&5Kx1a^GQPsP;Lycée général et technologique privé Saint Thomas d'Aquin Véritas;Oullins
57;richard45;P2IyOyA6(g6k;Lycée général et technologique privé Sainte Marie;Lyon 5e  Arrondissement
58;andree24;J&8K0cni*bJ5;Lycée général et technologique René Descartes;Saint-Genis-Laval
59;lauger;T%N8C16(MuN5;Lycée général et technologique Robert Doisneau;Vaulx-en-Velin
60;therese36;ZNIehkqm#z98;Lycée général et technologique Saint-Just;Lyon 5e  Arrondissement
61;diane46;(FO3+fUif(QF;Lycée général Germaine Tillion;Sain-Bel
62;maillotanastasie;w8CT(DIhKN&u;Lycée général privé Acadomia Campus;Lyon 7e  Arrondissement
63;jeanmahe;a$v5Oq16Zale;Lycée général privé Beth Hanna;Villeurbanne
64;laurentpons;)2Fnml_W1v(o;Lycée général privé Chevreul;Lyon 7e  Arrondissement
65;margauxbriand;6*D_sjlqA91P;Lycée général privé Deborde;Lyon 6e  Arrondissement
66;francoisclaudine;4ija8L8@(CSt;Lycée général privé Externat de La Trinité;Lyon 6e  Arrondissement
67;vdelannoy;0^(Fo8FkRcOr;Lycée général privé Immaculée-Conception;Villeurbanne
68;bblanc;)EZzx(Vs+R3);Lycée général privé Juif de Lyon;Villeurbanne
69;lerouxaime;^9v6XRsS_Wp5;Lycée général privé La Xavière;Lyon 8e  Arrondissement
70;kalbert;*9!%^D6l_jiE;Lycée général privé Notre Dame de Bellegarde;Neuville-sur-Saône
71;wvalette;5nqedoXL__^G;Lycée général privé Notre Dame de Mongré;Villefranche-sur-Saône
72;manon19;&#8n9*SwvkZ*;Lycée général privé Pierre Termier;Lyon 8e  Arrondissement
73;genevievegaudin;+7rLU7UxoH#v;Lycée général privé Saint Joseph;Tassin-la-Demi-Lune
74;remyclerc;AKCjwcpr$%9f;Lycée général privé Saint Marc;Lyon 2e  Arrondissement
75;menardcelina;b$iZS0X)+jw7;Lycée Général Rosa Parks;Neuville-sur-Saône
76;guerinanastasie;r^s8nWx0v)7B;Lycée polyvalent Aiguerande;Belleville-en-Beaujolais
77;mathilde06;#onYPoB$10mk;Lycée polyvalent Aragon-Picasso - Lycée des métiers;Givors
78;fhuet;kb5Lwlhh(Fkw;Lycée polyvalent Charlie Chaplin;Décines-Charpieu
79;alix13;7Ye#$T(9^9Ec;Lycée polyvalent Claude Bernard - Lycée des métiers de la vente, des services et du commerce;Villefranche-sur-Saône
80;ifontaine;#1lt@o50!5JZ;Lycée polyvalent Edouard Branly - Lycée des métiers de l'énergie, de la lumière et du numérique;Lyon 5e  Arrondissement
81;ojacquet;u%9o$Dq4UbuL;Lycée polyvalent Frédéric Fays - Lycée des métiers des techniques de conception et de production;Villeurbanne
82;rmaury;!YrF&sLwQf9O;Lycée polyvalent François Mansart;Thizy-les-Bourgs
83;imbertmichelle;^+xWmPUfGN3U;Lycée polyvalent François Rabelais;Dardilly
84;gguillou;&1vB5RhMw%no;Lycée polyvalent Hector Guimard - Lycée des métiers de la fonderie, de la plasturgie et des outillages associés, de la prothèse dentaire;Lyon 7e  Arrondissement
85;arthur09;k)A(khQpXI6I;Lycée polyvalent Jacques Brel;Vénissieux
86;constance49;+&^5eLcD^Zxi;Lycée polyvalent Louis Armand;Villefranche-sur-Saône
87;krichard;)sYddDO1O6R2;Lycée polyvalent privé Jehanne de France;Lyon 9e  Arrondissement
88;gfernandez;Z^Z!evKCB6jT;Lycée polyvalent René Cassin;Tarare
89;pmeunier;Sa1lf5hvb@Jw;Lycée professionnel agricole de Belleville;Belleville-en-Beaujolais
90;edith64;Jv3ZEeWdy*WW;Lycée professionnel Alfred de Musset - Lycée des métiers de la logistique et du transport - Lycée des métiers de la maintenance industrielle;Villeurbanne
91;leon24;g0gnT^ey&tjJ;Lycée professionnel André Cuzin - Lycée des métiers de la construction et de l'habitat durables;Caluire-et-Cuire
92;theodore47;hz70t(5gm^FP;Lycée professionnel Barthélémy Thimonnier - Lycée des métiers des services aux personnes et aux entreprises;L'Arbresle
93;manon73;#a*FHj6Xe+Q7;Lycée professionnel Camille Claudel - Lycée des métiers de la chapellerie, du tertiaire commercial et administratif;Lyon 4e  Arrondissement
94;honoredos-santos;8#9VfNXeoQB%;Lycée professionnel Danielle Casanova - Lycée des métiers du cuir et des services;Givors
95;maryedith;x^5(PMziCltD;Lycée professionnel Diderot - Lycée des métiers du textile, de l'habillement et de la maintenance industrielle;Lyon 1er Arrondissement
96;jules00;O%%DDaIO^y49;Lycée professionnel du 1er Film - Lycée des métiers de la beauté, la communication et la restauration;Lyon 8e  Arrondissement
97;benjamin96;cVVpY%UR%#L9;Lycée professionnel Edmond Labbé - Lycée des métiers de l'énergie;Oullins
98;jeanbrunel;^04fHUOfBAMF;Lycée professionnel Emile Béjuit - Automobile - Lycée des métiers de l'automobile et du transport;Bron
99;vcordier;(bs1Vpjy%0L*;Lycée professionnel Fernand Forest;Saint-Priest
100;simonphilippe;bo9XnPqUE%#T;Lycée professionnel François Cevert;Ecully
101;ale-gall;$w3wIiXBrNPv;Lycée professionnel Georges Lamarque - Lycée des métiers des arts et techniques du bois et de la tapisserie d'ameublement;Rillieux-la-Pape
102;raymond13;Du91tGVlby!W;Lycée professionnel Gustave Eiffel;Brignais
103;payetbenjamin;^R09N!Mwm$4K;Lycée professionnel Hélène Boucher - Lycée des métiers de la restauration, de la proprete et de l'environnement;Vénissieux
104;barregeorges;hhUK3O_f4L!(;Lycée professionnel Jacques de Flesselles - Lycée des métiers du génie électrique et de la bureautique;Lyon 1er Arrondissement
105;nathalie74;fT1mii84^e1P;Lycée professionnel Jean Lurçat - Lycée des métiers des services aux  personnes et aux entreprises;Lyon 8e  Arrondissement
106;anais91;#PKsnu*#33eM;Lycée professionnel Joseph-Marie Jacquard - Lycée des métiers mode - LYC MET services personne et entreprise - LYC MET réseau textile mode cuir;Oullins
107;chauveteric;*iRXqjl0D1Cv;Lycée professionnel Les Canuts - Lycée des métiers de l'électrotechnique - Lycée des métiers de la vente;Vaulx-en-Velin
108;julesmenard;fQt25@LbQ@!_;Lycée professionnel Louise Labé - Lycée des métiers réseau textile mode cuir;Lyon 7e  Arrondissement
109;marchandxavier;!(u6HbDy!EoW;Lycée professionnel Magenta - Lycée des métiers des services administratifs;Villeurbanne
110;virginielecoq;8R*H!4Ptk%*u;Lycée professionnel Marc Seguin;Vénissieux
111;marteloceane;mVf6Fkkn$hg2;Lycée professionnel Marie Curie - Lycée des métiers du commerce et du service à la personne;Villeurbanne
112;lgosselin;6eMR1Sqw#c6G;Lycée professionnel privé Ateliers d'Apprentissage de l'Industrie;Vaulx-en-Velin
113;stephanebrun;1%2oG6Za_!LD;Lycée professionnel privé Carrel - Lycée des métiers des relations commerciales;Lyon 6e  Arrondissement
114;rogerbernier;qZ60WFVcE@*p;Lycée professionnel privé Chevreul Lestonnac;Lyon 7e  Arrondissement
115;anastasiemaury;Oj5X6TnzhO!z;Lycée professionnel privé de Coiffure de Lyon;Lyon 4e  Arrondissement
116;marcel80;Oo6aDwoN@Z5%;Lycée professionnel privé des Arts de la Coiffure - Lycée des métiers des arts de la coiffure;Lyon 1er Arrondissement
117;gillesfrancois;&HV@A$nyT7R&;Lycée professionnel privé Don Bosco - Lycée des métiers des services à la personne;Lyon 5e  Arrondissement
118;bonnetlucy;c0CZ9Nue&aEj;Lycée professionnel privé Institut Technique des Carrières Carole;Lyon 2e  Arrondissement
119;rsanchez;!$Q%FC6s)N6);Lycée professionnel privé Interfora;Saint-Fons
120;bhardy;$4#1RhYp)7V9;Lycée professionnel privé Japy - Lycée des métiers de la vente et de la gestion administrative;Lyon 1er Arrondissement
121;claudine76;$H&xLTh$302A;Lycée professionnel privé Jean-Baptiste de La Salle;Lyon 1er Arrondissement
122;isaacguillot;Q4wLeU9i^g8F;Lycée professionnel privé La Favorite Sainte Thérèse;Sainte-Foy-lès-Lyon
123;aurorejourdan;!d^eSqs4Z423;Lycée professionnel privé La Mache - Lycée des métiers de la production et des technologies industrielles;Lyon 8e  Arrondissement
124;vbesson;$(PwJ(UqM9yY;Lycée professionnel privé La Vidaude;Saint-Genis-Laval
125;raubert;y+6!4GiD4t%Z;Lycée professionnel privé Notre Dame G;Givors
126;jmace;%Z9*me4Jy0GA;Lycée professionnel privé Notre Dame V;Villefranche-sur-Saône
127;adrienne34;EDixXcUTj_0g;Lycée professionnel privé Orsel;Oullins
128;bernierandre;H&@0NnlWPXJE;Lycée professionnel privé ORT;Lyon 8e  Arrondissement
129;ggarcia;r5BcFW8^#)Vd;Lycée professionnel privé Saint Charles - Lycée des métiers des systèmes électroniques et du commerce;Rillieux-la-Pape
130;rleveque;xfZynHBh&7QU;Lycée professionnel privé Saint Joseph - Lycée des métiers de l'énergie, de la gestion-administration et de la relation clientèle;Lyon 7e  Arrondissement
131;voisinthibault;(WkJ%2yE135W;Lycée professionnel privé Saint Louis-Saint Bruno - Lycée des métiers du tertiaire administratif et commercial;Lyon 1er Arrondissement
132;barthelemyeleonore;8BkER9rn$b2T;Lycée professionnel privé Saint Marc - Lycée des métiers des services administratifs et de la vente;Lyon 2e  Arrondissement
133;pierre67;pW9)#(hB(C6P;Lycée professionnel privé Société Enseignement Professionnel du Rhône - Lycée des métiers du réseau textile mode cuir;Lyon 3e  Arrondissement
134;ibouchet;X5k8BJuI^DbA;Lycée professionnel Sermenaz;Rillieux-la-Pape
135;opotier;%$@lsu7V4SVs;Lycée professionnel Tony Garnier - Lycée des métiers du bâtiment et des travaux publics;Bron
136;lacombeantoinette;^eh9lJskIWNu;Lycée technologique privé Carrel;Lyon 6e  Arrondissement
137;emilie19;fk!0ebMc!V#!;Lycée technologique privé Don Bosco;Lyon 5e  Arrondissement
138;mmarchand;%h6xQu#tOQc&;Lycée technologique privé ICOF;Lyon 5e  Arrondissement
139;fouquetjacques;10*yvcYhHZ5D;Lycée technologique privé La Mache;Lyon 8e  Arrondissement
140;tbaron;h+96WYscJmSs;Lycée technologique privé Notre Dame;Villefranche-sur-Saône
141;antoine89;A&VJ)tqG^6f(;Lycée technologique privé ORT;Lyon 8e  Arrondissement
142;pagesedouard;#o8JOIb0tKQx;Section d'enseignement professionnel du Lycée polyvalent Aiguerande;Belleville-en-Beaujolais
143;colette94;lIBu6oTd@L(i;Section d'enseignement professionnel du Lycée polyvalent Aragon-Picasso;Givors
144;gillesbodin;%7B8ufGy73_h;Section d'enseignement professionnel du Lycée polyvalent Charlie Chaplin;Décines-Charpieu
145;icosta;)4ib(ee)*RPf;Section d'enseignement professionnel du Lycée polyvalent Claude Bernard;Villefranche-sur-Saône
146;agathe17;(EMY5VqB_0@n;Section d'enseignement professionnel du Lycée polyvalent Edouard Branly;Lyon 5e  Arrondissement
147;louiscatherine;CwaaD$Gb#p!2;Section d'enseignement professionnel du Lycée polyvalent Frédéric Fays;Villeurbanne
148;thomas03;Mu3EBoty^&hV;Section d'enseignement professionnel du Lycée polyvalent François Mansart;Thizy-les-Bourgs
149;pirestristan;%OYofBSqd7tL;Section d'enseignement professionnel du Lycée polyvalent François Rabelais;Dardilly
150;lemairemaggie;Oa191fsX_L6R;Section d'enseignement professionnel du Lycée polyvalent Hector Guimard;Lyon 7e  Arrondissement
151;thierrymoreno;(19fc^mhf)8X;Section d'enseignement professionnel du Lycée polyvalent Jacques Brel;Vénissieux
152;elodieauger;@9SJyqjI94Ka;Section d'enseignement professionnel du Lycée polyvalent Louis Armand;Villefranche-sur-Saône
153;duvalfrancoise;*umyFSy)u$^5;Section d'enseignement professionnel du Lycée polyvalent privé Jehanne de France;Lyon 9e  Arrondissement
154;penelopeda-costa;&HAGFjw56&c7;Section d'enseignement professionnel du Lycée polyvalent René Cassin;Tarare
